{
  "automaticProformaInvoiceCommunication": false,
  "billingAddress": {
    "ID": "17831",
    "addressLine": "K Vypichu 1149",
    "addressName": "PORT BANGKOK",
    "cityName": "BANGKOK",
    "country": {
      "identificationCode": "TH"
    },
    "countrySubEntityCode": "BK",
    "postalZone": "THBKK"
  },
  "billingContact": {
    "ID": "123456",
    "firstName": "Jos",
    "familyName": "Smos"
  },
  "callOff": false,
  "confirmedDeliveryDate": {
    "from": "2016-02-11",
    "till": "2016-02-15"
  },
  "customer": {
    "ID": "12481",
    "callSign": "Loomans"
  },
  "customerOrderReference": "SALES4875",
  "deliveryInstructions": "These are my delivery instructions",
  "deliveryTerm": {
    "ID": "10",
    "description": "EXW"
  },
  "destinationAddress": {
    "ID": "583583",
    "addressLine": "Postbus 1350",
    "addressName": "BOEKELO DECOR",
    "cityName": "ENSCHEDE",
    "country": {
      "identificationCode": "NL"
    },
    "countrySubEntityCode": "OVL",
    "postalZone": "7500 BJ"
  },
  "fuelSurcharge": true,
  "internalComment": "This is my internal comment",
  "loadDate": "2016-02-07",
  "loadingInstructions": "These are my loading instructions",
  "entity": {
    "ID": "124",
    "callSign": "Company Distribution"
  },
  "reactiveSalesPerson": {
    "ID": "71948",
    "firstName": "Tom",
    "familyName": "Aat"
  },
  "requestedDeliveryDate": {
    "from": "2016-01-15",
    "till": "2016-02-29"
  },
  "requireManualAcceptance": false,
  "salesPerson": {
    "ID": "201591",
    "firstName": "Peter",
    "familyName": "Seli"
  },
  "transportType": {
    "ID": "124",
    "description": "ROAD"
  },
  "version": 1
}